{
  "dataset": "d365-finops-pqu",
  "schema_version": "1.1.0",
  "generated_at": "2026-10-19T19:11:52.848489Z",
  "source": {
    "publisher": "Microsoft",
    "repository": "MicrosoftDocs/dynamics-365-unified-operations-public",
    "branch": "main",
    "file_path": "articles/fin-ops-core/dev-itpro/get-started/quality-updates-schedule.md",
    "commit": "cb977385a7ab71c306533725527086bc30d9f548",
    "article_url": "https://learn.microsoft.com/en-us/dynamics365/fin-ops-core/dev-itpro/get-started/quality-updates-schedule",
    "raw_url": "https://raw.githubusercontent.com/MicrosoftDocs/dynamics-365-unified-operations-public/cb977385a7ab71c306533725527086bc30d9f548/articles/fin-ops-core/dev-itpro/get-started/quality-updates-schedule.md",
    "markdown_date": "2026-10-13",
    "sha256": "2cc9773677d90a03e730b761f4f7825cde114e0f72564b27e14fae4ae902a588",
    "retrieved_at": "2026-10-19T19:11:52.848489Z"
  },
  "count": 59,
  "records": [
    {
      "pqu_id": "10.0.46-PQU-1",
      "application_version": "10.0.46",
      "pqu_train": "PQU-1",
      "release_number": 1,
      "status": "Completed",
      "application_build": "10.0.2428.95",
      "platform_build": "7.0.7778.45",
      "uep_version": null,
      "change_cutoff_date": "2026-02-04",
      "train_start_date": "2025-02-09",
      "train_end_date": "2026-03-14"
    },
    {
      "pqu_id": "10.0.46-PQU-2",
      "application_version": "10.0.46",
      "pqu_train": "PQU-2",
      "release_number": 2,
      "status": "Completed",
      "application_build": "10.0.2428.114",
      "platform_build": "7.0.7778.56",
      "uep_version": null,
      "change_cutoff_date": "2026-03-04",
      "train_start_date": "2026-03-09",
      "train_end_date": "2026-04-11"
    },
    {
      "pqu_id": "10.0.46-PQU-3",
      "application_version": "10.0.46",
      "pqu_train": "PQU-3",
      "release_number": 3,
      "status": "Completed",
      "application_build": "10.0.2428.139",
      "platform_build": "7.0.7778.76",
      "uep_version": null,
      "change_cutoff_date": "2026-04-01",
      "train_start_date": "2026-04-06",
      "train_end_date": "2026-05-09"
    },
    {
      "pqu_id": "10.0.46-PQU-4",
      "application_version": "10.0.46",
      "pqu_train": "PQU-4",
      "release_number": 4,
      "status": "Completed",
      "application_build": "10.0.2428.169",
      "platform_build": "7.0.7778.104",
      "uep_version": null,
      "change_cutoff_date": "2026-04-29",
      "train_start_date": "2026-05-04",
      "train_end_date": "2026-06-06"
    },
    {
      "pqu_id": "10.0.46-PQU-5",
      "application_version": "10.0.46",
      "pqu_train": "PQU-5",
      "release_number": 5,
      "status": "Completed",
      "application_build": "10.0.2428.188",
      "platform_build": "7.0.7778.118",
      "uep_version": null,
      "change_cutoff_date": "2026-05-27",
      "train_start_date": "2026-06-01",
      "train_end_date": "2026-07-05"
    },
    {
      "pqu_id": "10.0.46-PQU-6",
      "application_version": "10.0.46",
      "pqu_train": "PQU-6",
      "release_number": 6,
      "status": "Completed",
      "application_build": "10.0.2428.205",
      "platform_build": "7.0.7778.137",
      "uep_version": null,
      "change_cutoff_date": "2026-06-24",
      "train_start_date": "2026-06-29",
      "train_end_date": "2026-08-01"
    },
    {
      "pqu_id": "10.0.46-PQU-7",
      "application_version": "10.0.46",
      "pqu_train": "PQU-7",
      "release_number": 7,
      "status": "Completed",
      "application_build": "10.0.2428.220",
      "platform_build": "7.0.7778.145",
      "uep_version": null,
      "change_cutoff_date": "2026-07-22",
      "train_start_date": "2026-07-27",
      "train_end_date": "2026-08-29"
    },
    {
      "pqu_id": "10.0.46-PQU-8",
      "application_version": "10.0.46",
      "pqu_train": "PQU-8",
      "release_number": 8,
      "status": "Completed",
      "application_build": "10.0.2428.236",
      "platform_build": "7.0.7778.149",
      "uep_version": null,
      "change_cutoff_date": "2026-08-21",
      "train_start_date": "2026-08-31",
      "train_end_date": "2026-10-03"
    },
    {
      "pqu_id": "10.0.47-PQU-1",
      "application_version": "10.0.47",
      "pqu_train": "PQU-1",
      "release_number": 1,
      "status": "Completed",
      "application_build": "10.0.2527.78",
      "platform_build": "7.0.7858.54",
      "uep_version": null,
      "change_cutoff_date": "2026-04-08",
      "train_start_date": "2026-04-08",
      "train_end_date": "2026-05-02"
    },
    {
      "pqu_id": "10.0.47-PQU-2",
      "application_version": "10.0.47",
      "pqu_train": "PQU-2",
      "release_number": 2,
      "status": "Canceled",
      "application_build": null,
      "platform_build": null,
      "uep_version": null,
      "change_cutoff_date": "2026-04-22",
      "train_start_date": "2026-04-22",
      "train_end_date": "2026-05-16"
    },
    {
      "pqu_id": "10.0.47-PQU-3",
      "application_version": "10.0.47",
      "pqu_train": "PQU-3",
      "release_number": 3,
      "status": "Completed",
      "application_build": "10.0.2527.109",
      "platform_build": "7.0.7858.96",
      "uep_version": null,
      "change_cutoff_date": "2026-05-06",
      "train_start_date": "2026-05-06",
      "train_end_date": "2026-05-30"
    },
    {
      "pqu_id": "10.0.47-PQU-4",
      "application_version": "10.0.47",
      "pqu_train": "PQU-4",
      "release_number": 4,
      "status": "Completed",
      "application_build": "10.0.2527.116",
      "platform_build": "7.0.7858.102",
      "uep_version": null,
      "change_cutoff_date": "2026-05-20",
      "train_start_date": "2026-05-20",
      "train_end_date": "2026-06-13"
    },
    {
      "pqu_id": "10.0.47-PQU-5",
      "application_version": "10.0.47",
      "pqu_train": "PQU-5",
      "release_number": 5,
      "status": "Completed",
      "application_build": "10.0.2527.130",
      "platform_build": "7.0.7858.111",
      "uep_version": null,
      "change_cutoff_date": "2026-06-03",
      "train_start_date": "2026-06-03",
      "train_end_date": "2026-06-27"
    },
    {
      "pqu_id": "10.0.47-PQU-6",
      "application_version": "10.0.47",
      "pqu_train": "PQU-6",
      "release_number": 6,
      "status": "Completed",
      "application_build": "10.0.2527.142",
      "platform_build": "7.0.7858.121",
      "uep_version": null,
      "change_cutoff_date": "2026-06-17",
      "train_start_date": "2026-06-17",
      "train_end_date": "2026-07-11"
    },
    {
      "pqu_id": "10.0.47-PQU-7",
      "application_version": "10.0.47",
      "pqu_train": "PQU-7",
      "release_number": 7,
      "status": "Completed",
      "application_build": "10.0.2527.152",
      "platform_build": "7.0.7858.132",
      "uep_version": null,
      "change_cutoff_date": "2026-07-01",
      "train_start_date": "2026-07-01",
      "train_end_date": "2026-07-25"
    },
    {
      "pqu_id": "10.0.47-PQU-8",
      "application_version": "10.0.47",
      "pqu_train": "PQU-8",
      "release_number": 8,
      "status": "Completed",
      "application_build": "10.0.2527.160",
      "platform_build": "7.0.7858.134",
      "uep_version": null,
      "change_cutoff_date": "2026-07-15",
      "train_start_date": "2026-07-15",
      "train_end_date": "2026-08-08"
    },
    {
      "pqu_id": "10.0.47-PQU-9",
      "application_version": "10.0.47",
      "pqu_train": "PQU-9",
      "release_number": 9,
      "status": "Completed",
      "application_build": "10.0.2527.174",
      "platform_build": "7.0.7858.145",
      "uep_version": null,
      "change_cutoff_date": "2026-07-29",
      "train_start_date": "2026-07-29",
      "train_end_date": "2026-08-22"
    },
    {
      "pqu_id": "10.0.47-PQU-10",
      "application_version": "10.0.47",
      "pqu_train": "PQU-10",
      "release_number": 10,
      "status": "Completed",
      "application_build": "10.0.2527.187",
      "platform_build": "7.0.7858.152",
      "uep_version": null,
      "change_cutoff_date": "2026-08-12",
      "train_start_date": "2026-08-12",
      "train_end_date": "2026-09-05"
    },
    {
      "pqu_id": "10.0.47-PQU-11",
      "application_version": "10.0.47",
      "pqu_train": "PQU-11",
      "release_number": 11,
      "status": "Completed",
      "application_build": "10.0.2527.197",
      "platform_build": "7.0.7858.163",
      "uep_version": null,
      "change_cutoff_date": "2026-08-26",
      "train_start_date": "2026-08-26",
      "train_end_date": "2026-09-19"
    },
    {
      "pqu_id": "10.0.47-PQU-12",
      "application_version": "10.0.47",
      "pqu_train": "PQU-12",
      "release_number": 12,
      "status": "Completed",
      "application_build": "10.0.2527.208",
      "platform_build": "7.0.7858.166",
      "uep_version": null,
      "change_cutoff_date": "2026-09-09",
      "train_start_date": "2026-09-09",
      "train_end_date": "2026-10-03"
    },
    {
      "pqu_id": "10.0.47-PQU-13",
      "application_version": "10.0.47",
      "pqu_train": "PQU-13",
      "release_number": 13,
      "status": "Completed",
      "application_build": "10.0.2527.215",
      "platform_build": "7.0.7858.174",
      "uep_version": null,
      "change_cutoff_date": "2026-09-23",
      "train_start_date": "2026-09-23",
      "train_end_date": "2026-10-17"
    },
    {
      "pqu_id": "10.0.47-PQU-14",
      "application_version": "10.0.47",
      "pqu_train": "PQU-14",
      "release_number": 14,
      "status": "In-Progress",
      "application_build": "10.0.2527.227",
      "platform_build": "7.0.7858.178",
      "uep_version": "10.0.47.15",
      "change_cutoff_date": "2026-10-07",
      "train_start_date": "2026-10-07",
      "train_end_date": "2026-10-31"
    },
    {
      "pqu_id": "10.0.47-PQU-15",
      "application_version": "10.0.47",
      "pqu_train": "PQU-15",
      "release_number": 15,
      "status": "In-Progress",
      "application_build": "10.0.2527.237",
      "platform_build": "7.0.7858.180",